{
    "$schema": "../docs/rationalization.schema.json",
    "id": 14,
    "input-text": [
        "When",
        " my",
        " flight",
        " landed",
        " in",
        " Russia",
        ",",
        " I",
        " converted",
        " my",
        " currency",
        " and",
        " slowly",
        " fell",
        " asleep",
        ".",
        " (",
        "I",
        " had",
        " a",
        " terrifying",
        " dream",
        " about",
        " my",
        " grandmother",
        ",",
        " but",
        " that",
        "'s",
        " a",
        " story",
        " for",
        " another",
        " time",
        ").",
        " I",
        " was",
        " staying",
        " in",
        " the",
        " capital",
        ","
    ],
    "input-tokens": [
        2215,
        616,
        5474,
        11406,
        287,
        3284,
        11,
        314,
        11513,
        616,
        7395,
        290,
        6364,
        3214,
        16039,
        13,
        357,
        40,
        550,
        257,
        17623,
        4320,
        546,
        616,
        18410,
        11,
        475,
        326,
        338,
        257,
        1621,
        329,
        1194,
        640,
        737,
        314,
        373,
        10589,
        287,
        262,
        3139,
        11
    ],
    "target-text": " Moscow",
    "target-token": 9070,
    "rational-size": 5,
    "rational-positions": [
        40,
        5,
        37,
        0,
        2
    ],
    "rational-text": [
        " capital",
        " Russia",
        " staying",
        "When",
        " flight"
    ],
    "rational-tokens": [
        3139,
        3284,
        10589,
        2215,
        5474
    ],
    "importance-scores": [
        0.02870972268283367,
        0.024930497631430626,
        0.028489328920841217,
        0.025900879874825478,
        0.02237175777554512,
        0.035737212747335434,
        0.020986400544643402,
        0.021148663014173508,
        0.02437606267631054,
        0.021524690091609955,
        0.02601613849401474,
        0.021364305168390274,
        0.022689446806907654,
        0.021890971809625626,
        0.023894591256976128,
        0.022141598165035248,
        0.02283666282892227,
        0.021497394889593124,
        0.021288538351655006,
        0.020481066778302193,
        0.026239585131406784,
        0.022448519244790077,
        0.02168267033994198,
        0.02163434773683548,
        0.024474158883094788,
        0.020613400265574455,
        0.021757619455456734,
        0.020982077345252037,
        0.022195778787136078,
        0.020805545151233673,
        0.022680891677737236,
        0.02050144597887993,
        0.02145874686539173,
        0.020716534927487373,
        0.025155486539006233,
        0.022285988554358482,
        0.021809959784150124,
        0.029002435505390167,
        0.02161557972431183,
        0.022214481607079506,
        0.04567864537239075,
        0.025770124047994614
    ],
    "comments": {
        "created-by": "run_analogies.py",
        "args": {
            "model": "gpt2-xl",
            "cache_dir": "cache/",
            "tokenizer": "gpt2-xl",
            "data_dir": "data/analogies/gpt2_xl/",
            "importance_results_dir": "rationalization_results/analogies/gpt2_xl_norm",
            "device": "cuda",
            "rationalization_config": "config/eva_norm.json",
            "input_num_ratio": 1,
            "logfolder": "logs/analogies/gpt2_xl_norm",
            "loglevel": 20
        },
        "time_elapsed": 0.06420636177062988
    }
}