{
    "$schema": "../docs/rationalization.schema.json",
    "id": 119,
    "input-text": [
        "I",
        " had",
        " never",
        " been",
        " friends",
        " with",
        " any",
        " Bulgarian",
        " people",
        " before",
        ".",
        " (",
        "The",
        " funn",
        "iest",
        " thing",
        " happened",
        " to",
        " me",
        " the",
        " other",
        " day",
        ",",
        " but",
        " that",
        "'s",
        " a",
        " story",
        " for",
        " another",
        " time",
        ").",
        " In",
        " fact",
        ",",
        " I",
        " had",
        " never",
        " even",
        " been",
        " to"
    ],
    "input-tokens": [
        40,
        550,
        1239,
        587,
        2460,
        351,
        597,
        42119,
        661,
        878,
        13,
        357,
        464,
        36090,
        6386,
        1517,
        3022,
        284,
        502,
        262,
        584,
        1110,
        11,
        475,
        326,
        338,
        257,
        1621,
        329,
        1194,
        640,
        737,
        554,
        1109,
        11,
        314,
        550,
        1239,
        772,
        587,
        284
    ],
    "target-text": " Bulgaria",
    "target-token": 27902,
    "rational-size": 5,
    "rational-positions": [
        0,
        40,
        7,
        32,
        10
    ],
    "rational-text": [
        "I",
        " to",
        " Bulgarian",
        " In",
        "."
    ],
    "rational-tokens": [
        40,
        284,
        42119,
        554,
        13
    ],
    "importance-scores": [
        0.0357280895113945,
        0.024041691794991493,
        0.024016017094254494,
        0.023881400004029274,
        0.023919854313135147,
        0.02421284280717373,
        0.023934204131364822,
        0.02544364146888256,
        0.024163728579878807,
        0.024196257814764977,
        0.024681685492396355,
        0.024426663294434547,
        0.02421465329825878,
        0.02385169453918934,
        0.02385774441063404,
        0.023829232901334763,
        0.02389148250222206,
        0.023921938613057137,
        0.023948723450303078,
        0.02387220412492752,
        0.023836709558963776,
        0.02394598163664341,
        0.024042798206210136,
        0.023868801072239876,
        0.02379039116203785,
        0.023790715262293816,
        0.02379004657268524,
        0.023804398253560066,
        0.023820487782359123,
        0.02378397434949875,
        0.0238186102360487,
        0.02448238991200924,
        0.024874409660696983,
        0.024096837267279625,
        0.02443055622279644,
        0.02406265400350094,
        0.023963408544659615,
        0.023933665826916695,
        0.02391430363059044,
        0.023890309035778046,
        0.026024790480732918
    ],
    "comments": {
        "created-by": "run_analogies.py",
        "args": {
            "model": "gpt2-medium",
            "cache_dir": "./cache/",
            "tokenizer": "gpt2-medium",
            "data_dir": "data/analogies/gpt2/",
            "importance_results_dir": "rationalization_results/analogies/gpt2_attention_last",
            "device": "cuda",
            "rationalization_config": "config/eva_attention_last.json",
            "input_num_ratio": 1,
            "logfolder": "logs/analogies/gpt2_attention_last",
            "loglevel": 20
        },
        "time_elapsed": 0.013032674789428711
    }
}