{
    "$schema": "../docs/rationalization.schema.json",
    "id": 157,
    "input-text": [
        "I",
        " had",
        " never",
        " been",
        " friends",
        " with",
        " any",
        " Israeli",
        " people",
        " before",
        ".",
        " (",
        "The",
        " funn",
        "iest",
        " thing",
        " happened",
        " to",
        " me",
        " the",
        " other",
        " day",
        ",",
        " but",
        " that",
        "'s",
        " a",
        " story",
        " for",
        " another",
        " time",
        ").",
        " In",
        " fact",
        ",",
        " I",
        " had",
        " never",
        " even",
        " been",
        " to"
    ],
    "input-tokens": [
        40,
        550,
        1239,
        587,
        2460,
        351,
        597,
        6085,
        661,
        878,
        13,
        357,
        464,
        36090,
        6386,
        1517,
        3022,
        284,
        502,
        262,
        584,
        1110,
        11,
        475,
        326,
        338,
        257,
        1621,
        329,
        1194,
        640,
        737,
        554,
        1109,
        11,
        314,
        550,
        1239,
        772,
        587,
        284
    ],
    "target-text": " Israel",
    "target-token": 2692,
    "rational-size": 8,
    "rational-positions": [
        7,
        17,
        23,
        25,
        28,
        30,
        39,
        40
    ],
    "rational-text": [
        " Israeli",
        " to",
        " but",
        "'s",
        " for",
        " time",
        " been",
        " to"
    ],
    "rational-tokens": [
        6085,
        284,
        475,
        338,
        329,
        640,
        587,
        284
    ],
    "importance-scores": [
        8.942087958985212e-08,
        3.8766521015531907e-07,
        0.0001983251131605357,
        9.414157830178738e-06,
        5.843485268997028e-07,
        4.278143478586571e-06,
        5.547113687498495e-05,
        0.38219815492630005,
        1.4878725096423295e-07,
        0.0003216892364434898,
        8.202487578046203e-08,
        2.9004189627812593e-07,
        2.9077631324980757e-07,
        3.5739583381655393e-06,
        0.0011244128691032529,
        2.1431478103295376e-07,
        6.699382311126101e-07,
        5.243018108558317e-07,
        1.7741398323778412e-06,
        4.6519065932670856e-08,
        9.157535174608711e-08,
        8.233807307078678e-07,
        1.5935572719172342e-06,
        4.797144720214419e-05,
        4.0143464730135747e-07,
        5.556897804126493e-07,
        3.842397745756898e-06,
        0.001244959537871182,
        0.1033368930220604,
        0.012726493179798126,
        0.02858864702284336,
        8.224229532061145e-06,
        2.939001660706708e-06,
        0.008928603492677212,
        2.2223828636924736e-05,
        0.0003031688102055341,
        2.181147920055082e-07,
        0.005693280138075352,
        0.004906428512185812,
        0.4502001404762268,
        6.212273729033768e-05
    ],
    "comments": {
        "created-by": "run_analogies.py",
        "args": {
            "model": "gpt2-xl",
            "cache_dir": "cache/",
            "tokenizer": "gpt2-xl",
            "data_dir": "data/analogies/gpt2_xl",
            "importance_results_dir": "rationalization_results/analogies/gpt2_xl_ours/top3_replace0.1_max5000_batch5",
            "device": "cuda",
            "rationalization_config": "config//top3_replace0.1_max5000_batch5.json",
            "input_num_ratio": 1.0,
            "logfolder": "logs/analogies/gpt2_xl_ours/top3_replace0.1_max5000_batch5",
            "loglevel": 20
        },
        "time_elapsed": 24.180296182632446,
        "separate_rational": [
            [
                " Israeli",
                " been",
                " to",
                "'s",
                " had",
                " any",
                " the",
                " ("
            ],
            [
                " Israeli",
                " been",
                " time",
                " never",
                " never",
                " for",
                " to",
                " but"
            ],
            [
                " been",
                " to",
                "'s",
                " Israeli",
                " had",
                " time",
                " me",
                " people"
            ],
            [
                " for",
                " Israeli",
                " another",
                " fact",
                " even",
                " story",
                " been",
                "iest"
            ],
            [
                " been",
                " Israeli",
                " but",
                " to",
                " friends",
                " thing",
                ").",
                " time"
            ]
        ]
    }
}