{
    "$schema": "../docs/rationalization.schema.json",
    "id": 9,
    "input-text": [
        "When",
        " my",
        " flight",
        " landed",
        " in",
        " Pakistan",
        ",",
        " I",
        " converted",
        " my",
        " currency",
        " and",
        " slowly",
        " fell",
        " asleep",
        ".",
        " (",
        "I",
        " had",
        " a",
        " terrifying",
        " dream",
        " about",
        " my",
        " grandmother",
        ",",
        " but",
        " that",
        "'s",
        " a",
        " story",
        " for",
        " another",
        " time",
        ").",
        " I",
        " was",
        " staying",
        " in",
        " the",
        " capital",
        ","
    ],
    "input-tokens": [
        2215,
        616,
        5474,
        11406,
        287,
        7648,
        11,
        314,
        11513,
        616,
        7395,
        290,
        6364,
        3214,
        16039,
        13,
        357,
        40,
        550,
        257,
        17623,
        4320,
        546,
        616,
        18410,
        11,
        475,
        326,
        338,
        257,
        1621,
        329,
        1194,
        640,
        737,
        314,
        373,
        10589,
        287,
        262,
        3139,
        11
    ],
    "target-text": " Islamabad",
    "target-token": 36878,
    "rational-size": 2,
    "rational-positions": [
        5,
        26
    ],
    "rational-text": [
        " Pakistan",
        " but"
    ],
    "rational-tokens": [
        7648,
        475
    ],
    "importance-scores": [
        9.486672114409809e-23,
        4.83795338368509e-06,
        3.403950824253249e-36,
        8.91232266967457e-28,
        0.9999948740005493,
        1.6313250750243924e-10,
        6.178347056368247e-31,
        7.949830595737986e-20,
        2.489703835558297e-18,
        3.218051808373274e-15,
        3.4252387801387447e-34,
        2.6578768140853617e-35,
        5.105920746118714e-29,
        2.9274439842821718e-30,
        7.117870377393812e-27,
        3.4287501193830394e-07,
        7.547724154030981e-31,
        2.303627483236968e-33,
        5.54943427144156e-19,
        6.990459412715595e-19,
        1.0647254375590548e-21,
        5.911653954338999e-32,
        3.984277587286805e-25,
        4.255206241469524e-27,
        1.8293703421932301e-38,
        4.937023245106519e-22,
        1.4158167378115618e-26,
        4.239336926935907e-23,
        2.733746104499204e-19,
        6.2851046414263e-16,
        1.9250097584497307e-18,
        3.2310152593227055e-31,
        2.4813486768776594e-12,
        1.9539057815726678e-20,
        2.3887759767841873e-27,
        3.9485611322087086e-29,
        1.9628479860343036e-35,
        6.627994334258347e-31,
        8.928030078338969e-16,
        3.7159316422508137e-13,
        2.788593578273435e-09,
        4.403810345977087e-30
    ],
    "comments": {
        "created-by": "run_analogies.py",
        "args": {
            "model": "gpt2-medium",
            "cache_dir": "cache/",
            "tokenizer": "gpt2-medium",
            "data_dir": "data/analogies/gpt2/",
            "importance_results_dir": "rationalization_results/analogies/gpt2_ours/top3_replace0.3_max3000_batch3",
            "device": "cuda",
            "rationalization_config": "config/gpt2/top3_replace0.3_max3000_batch3.json",
            "input_num_ratio": 1.0,
            "logfolder": "logs/analogies/gpt2_ours/top3_replace0.3_max3000_batch3",
            "loglevel": 20
        },
        "time_elapsed": 111.9455394744873,
        "separate_rational": [
            [
                " in",
                " my",
                ".",
                " capital",
                " Pakistan",
                " another",
                " the",
                " my"
            ],
            [
                " Pakistan",
                " (",
                ").",
                " but",
                " slowly",
                " that",
                " for",
                " was"
            ],
            [
                " staying",
                " flight",
                " I",
                " but",
                ",",
                " currency",
                "When",
                " time"
            ]
        ]
    }
}