{
    "$schema": "../docs/rationalization.schema.json",
    "id": 45,
    "input-text": [
        "When",
        " my",
        " flight",
        " landed",
        " in",
        " Philippines",
        ",",
        " I",
        " converted",
        " my",
        " currency",
        " and",
        " slowly",
        " fell",
        " asleep",
        ".",
        " (",
        "I",
        " was",
        " behind",
        " on",
        " a",
        " couple",
        " of",
        " assignments",
        ",",
        " but",
        " I",
        " tried",
        " not",
        " to",
        " think",
        " about",
        " them",
        ").",
        " I",
        " was",
        " staying",
        " in",
        " the",
        " capital",
        ","
    ],
    "input-tokens": [
        2215,
        616,
        5474,
        11406,
        287,
        13316,
        11,
        314,
        11513,
        616,
        7395,
        290,
        6364,
        3214,
        16039,
        13,
        357,
        40,
        373,
        2157,
        319,
        257,
        3155,
        286,
        25815,
        11,
        475,
        314,
        3088,
        407,
        284,
        892,
        546,
        606,
        737,
        314,
        373,
        10589,
        287,
        262,
        3139,
        11
    ],
    "target-text": " Manila",
    "target-token": 31721,
    "rational-size": 5,
    "rational-positions": [
        0,
        40,
        41,
        5,
        37
    ],
    "rational-text": [
        "When",
        " capital",
        ",",
        " Philippines",
        " staying"
    ],
    "rational-tokens": [
        2215,
        3139,
        11,
        13316,
        10589
    ],
    "importance-scores": [
        0.03802988678216934,
        0.02331063523888588,
        0.023297179490327835,
        0.02331448718905449,
        0.02338058315217495,
        0.024253366515040398,
        0.023396892473101616,
        0.023335633799433708,
        0.02327989600598812,
        0.023263132199645042,
        0.023277591913938522,
        0.023294972255825996,
        0.023259464651346207,
        0.023254211992025375,
        0.023293856531381607,
        0.023482825607061386,
        0.023323625326156616,
        0.02326291613280773,
        0.023268088698387146,
        0.02326340787112713,
        0.023248033598065376,
        0.023248689249157906,
        0.023235855624079704,
        0.023224979639053345,
        0.02330034039914608,
        0.023306410759687424,
        0.02331107296049595,
        0.023257749155163765,
        0.02326262928545475,
        0.023250380530953407,
        0.02325562760233879,
        0.023256119340658188,
        0.02327689714729786,
        0.023267829790711403,
        0.023775359615683556,
        0.02362356148660183,
        0.023734750226140022,
        0.023936618119478226,
        0.023886455222964287,
        0.023790080100297928,
        0.025265367701649666,
        0.02444254234433174
    ],
    "comments": {
        "created-by": "run_analogies.py",
        "args": {
            "model": "gpt2-medium",
            "cache_dir": "./cache/",
            "tokenizer": "gpt2-medium",
            "data_dir": "data/analogies/gpt2/",
            "importance_results_dir": "rationalization_results/analogies/gpt2_attention",
            "device": "cuda",
            "rationalization_config": "config/eva_attention.json",
            "input_num_ratio": 1,
            "logfolder": "logs/analogies/gpt2_attention",
            "loglevel": 20
        },
        "time_elapsed": 0.013713598251342773
    }
}