{
    "$schema": "../docs/rationalization.schema.json",
    "id": 107,
    "input-text": [
        "I",
        " thought",
        " it",
        " would",
        " be",
        " the",
        " oldest",
        " thing",
        " I",
        "'d",
        " ever",
        " encounter",
        ".",
        " (",
        "I",
        " tried",
        " to",
        " ignore",
        " my",
        " phone",
        " vibr",
        "ating",
        " in",
        " my",
        " pocket",
        ").",
        " But",
        " when",
        " I",
        " did",
        " end",
        " up",
        " encountering",
        " it",
        ",",
        " it",
        " turned",
        " out",
        " it",
        " wasn",
        "'t",
        " so"
    ],
    "input-tokens": [
        40,
        1807,
        340,
        561,
        307,
        262,
        13325,
        1517,
        314,
        1549,
        1683,
        8791,
        13,
        357,
        40,
        3088,
        284,
        8856,
        616,
        3072,
        12611,
        803,
        287,
        616,
        10000,
        737,
        887,
        618,
        314,
        750,
        886,
        510,
        42398,
        340,
        11,
        340,
        2900,
        503,
        340,
        2492,
        470,
        523
    ],
    "target-text": " old",
    "target-token": 1468,
    "rational-size": 4,
    "rational-positions": [
        0,
        6,
        40,
        41
    ],
    "rational-text": [
        "I",
        " oldest",
        "'t",
        " so"
    ],
    "rational-tokens": [
        40,
        13325,
        470,
        523
    ],
    "importance-scores": [
        3.056338300666539e-06,
        1.2378422632525776e-21,
        3.6129633569182356e-21,
        1.3598597433883697e-05,
        2.523740663403629e-18,
        4.724327765806895e-21,
        0.20000000298023224,
        0.20000000298023224,
        1.2893261272216791e-26,
        6.550975853360924e-14,
        1.6626060320563919e-15,
        2.5629347135678104e-21,
        5.225370756837426e-19,
        1.228746509266484e-24,
        3.9469912527147905e-14,
        6.736789132186921e-14,
        6.844833023933461e-06,
        4.4101223693770826e-17,
        0.17553463578224182,
        0.1927809864282608,
        8.50051407041974e-08,
        1.3817588911555298e-17,
        3.21949511494779e-09,
        1.9205312016412539e-28,
        8.443581036472453e-19,
        2.1315917509822507e-13,
        0.1999906599521637,
        1.0765749448265113e-24,
        2.154561643017615e-22,
        5.656583130011536e-24,
        1.4760359081161995e-15,
        2.9226819112245583e-19,
        0.024462301284074783,
        2.5071851723623695e-06,
        4.466302748549686e-22,
        6.014312041013187e-14,
        7.705638292157188e-15,
        1.0408782001621275e-20,
        2.461112657492768e-25,
        4.671252828991612e-10,
        1.3668082219690932e-18,
        0.007205330766737461
    ],
    "comments": {
        "created-by": "run_analogies.py",
        "args": {
            "model": "gpt2-medium",
            "cache_dir": "cache/",
            "tokenizer": "gpt2-medium",
            "data_dir": "data/analogies/gpt2/",
            "importance_results_dir": "rationalization_results/analogies/gpt2_ours",
            "device": "cuda",
            "rationalization_config": "config/aggregation.replacing_delta_prob.postag.json",
            "input_num_ratio": 1.0,
            "logfolder": "logs/analogies/gpt2_ours",
            "loglevel": 20
        },
        "time_elapsed": 108.0810956954956,
        "separate_rational": [
            [
                " thing",
                "'t",
                " thought",
                " so",
                ","
            ],
            [
                " But",
                " to",
                " it",
                " wasn",
                " so"
            ],
            [
                " phone",
                " so",
                " would",
                " vibr",
                " in"
            ],
            [
                " my",
                " encountering",
                "I",
                " oldest",
                ")."
            ],
            [
                " oldest",
                "'t",
                " it",
                " turned",
                "I"
            ]
        ]
    }
}