{
    "$schema": "../docs/rationalization.schema.json",
    "id": 32,
    "input-text": [
        "</s>",
        "Although",
        " I",
        " wrote",
        " yesterday",
        ",",
        " I",
        " had",
        " a",
        " million",
        " things",
        " to",
        " do",
        " today",
        ".",
        " (",
        "I",
        " suddenly",
        " felt",
        " a",
        " pin",
        "ched",
        " nerve",
        ",",
        " so",
        " I",
        " made",
        " a",
        " mental",
        " note",
        " to",
        " get",
        " that",
        " checked",
        " out",
        ").",
        " So",
        " today",
        " I",
        " wouldn",
        "'t",
        " have",
        " time",
        " to",
        " do",
        " any",
        " more"
    ],
    "input-tokens": [
        2,
        13863,
        38,
        875,
        2350,
        6,
        38,
        56,
        10,
        153,
        383,
        7,
        109,
        452,
        4,
        36,
        100,
        6017,
        1299,
        10,
        7756,
        3804,
        10387,
        6,
        98,
        38,
        156,
        10,
        2536,
        1591,
        7,
        120,
        14,
        7869,
        66,
        322,
        407,
        452,
        38,
        1979,
        75,
        33,
        86,
        7,
        109,
        143,
        55
    ],
    "target-text": " writing",
    "target-token": 2410,
    "rational-size": 10,
    "rational-positions": [
        3,
        8,
        9,
        22,
        26,
        29,
        32,
        41,
        44,
        46
    ],
    "rational-text": [
        " wrote",
        " a",
        " million",
        " nerve",
        " made",
        " note",
        " that",
        " have",
        " do",
        " more"
    ],
    "rational-tokens": [
        875,
        10,
        153,
        10387,
        156,
        1591,
        14,
        33,
        109,
        55
    ],
    "importance-scores": [
        NaN,
        NaN,
        NaN,
        NaN,
        NaN,
        NaN,
        NaN,
        NaN,
        NaN,
        NaN,
        NaN,
        NaN,
        NaN,
        NaN,
        NaN,
        NaN,
        NaN,
        NaN,
        NaN,
        NaN,
        NaN,
        NaN,
        NaN,
        NaN,
        NaN,
        NaN,
        NaN,
        NaN,
        NaN,
        NaN,
        NaN,
        NaN,
        NaN,
        NaN,
        NaN,
        NaN,
        NaN,
        NaN,
        NaN,
        NaN,
        NaN,
        NaN,
        NaN,
        NaN,
        NaN,
        NaN,
        NaN
    ],
    "comments": {
        "created-by": "run_analogies.py",
        "args": {
            "model": "KoboldAI/OPT-6.7B-Erebus",
            "cache_dir": "cache/",
            "tokenizer": "KoboldAI/OPT-6.7B-Erebus",
            "data_dir": "data/analogies/OPT6B/",
            "importance_results_dir": "rationalization_results/analogies/OPT6B_ours/top3_replace0.3_max3000_batch5",
            "device": "cuda",
            "rationalization_config": "config/OPT6B/top3_replace0.3_max3000_batch5.json",
            "input_num_ratio": 1.0,
            "logfolder": "logs/analogies/OPT6B_ours/top3_replace0.3_max3000_batch5",
            "loglevel": 20
        },
        "time_elapsed": 1455.8074598312378,
        "separate_rational": [
            [
                " any",
                " do",
                ").",
                " nerve",
                " (",
                " made",
                " have",
                " million"
            ],
            [
                " nerve",
                "ched",
                " checked",
                " to",
                " more",
                " that",
                " do",
                " a"
            ],
            [
                " wrote",
                " a",
                " pin",
                " to",
                " that",
                " note",
                " more",
                " have"
            ],
            [
                " more",
                " today",
                " a",
                " a",
                " I",
                " to",
                " wrote",
                " note"
            ],
            [
                " note",
                " do",
                " made",
                "Although",
                "'t",
                " so",
                " out",
                " million"
            ]
        ]
    }
}