{
    "$schema": "../docs/rationalization.schema.json",
    "id": 122,
    "input-text": [
        "I",
        " thought",
        " it",
        " would",
        " be",
        " the",
        " simplest",
        " thing",
        " I",
        "'d",
        " ever",
        " encounter",
        ".",
        " (",
        "I",
        " tried",
        " to",
        " ignore",
        " my",
        " phone",
        " vibr",
        "ating",
        " in",
        " my",
        " pocket",
        ").",
        " But",
        " when",
        " I",
        " did",
        " end",
        " up",
        " encountering",
        " it",
        ",",
        " it",
        " turned",
        " out",
        " it",
        " wasn",
        "'t",
        " so"
    ],
    "input-tokens": [
        40,
        1807,
        340,
        561,
        307,
        262,
        24043,
        1517,
        314,
        1549,
        1683,
        8791,
        13,
        357,
        40,
        3088,
        284,
        8856,
        616,
        3072,
        12611,
        803,
        287,
        616,
        10000,
        737,
        887,
        618,
        314,
        750,
        886,
        510,
        42398,
        340,
        11,
        340,
        2900,
        503,
        340,
        2492,
        470,
        523
    ],
    "target-text": " simple",
    "target-token": 2829,
    "rational-size": 11,
    "rational-positions": [
        6,
        10,
        15,
        20,
        30,
        32,
        37,
        38,
        39,
        40,
        41
    ],
    "rational-text": [
        " simplest",
        " ever",
        " tried",
        " vibr",
        " end",
        " encountering",
        " out",
        " it",
        " wasn",
        "'t",
        " so"
    ],
    "rational-tokens": [
        24043,
        1683,
        3088,
        12611,
        886,
        42398,
        503,
        340,
        2492,
        470,
        523
    ],
    "importance-scores": [
        2.2535150492331013e-05,
        8.813132808427326e-06,
        1.6097346815513447e-05,
        2.98772897622257e-06,
        1.0734902389231138e-05,
        3.73041802959051e-05,
        0.24205629527568817,
        1.293282002734486e-05,
        1.8618200556375086e-05,
        0.00014763169747311622,
        0.001972503960132599,
        8.927217095333617e-06,
        1.0056532119051553e-05,
        0.0017262116307392716,
        1.442093798686983e-05,
        0.00019072303257416934,
        0.00017860488151200116,
        2.699388915061718e-06,
        5.400334543992358e-07,
        0.00010439751349622384,
        0.0002933467330876738,
        1.4901817849022336e-05,
        6.306970590230776e-07,
        4.419836841407232e-06,
        1.7696336726658046e-05,
        1.6514011804247275e-05,
        0.1856968104839325,
        0.0007541522500105202,
        3.176687823724933e-05,
        0.19533053040504456,
        0.0014662591274827719,
        0.0018628652906045318,
        0.00011111852654721588,
        1.1687959158734884e-05,
        4.0299013903677405e-07,
        0.003440842032432556,
        0.010782593861222267,
        0.00042122596642002463,
        0.011585782282054424,
        0.00015898968558758497,
        0.11037920415401459,
        0.2310752421617508
    ],
    "comments": {
        "created-by": "run_analogies.py",
        "args": {
            "model": "gpt2-xl",
            "cache_dir": "cache/",
            "tokenizer": "gpt2-xl",
            "data_dir": "data/analogies/gpt2_xl",
            "importance_results_dir": "rationalization_results/analogies/gpt2_xl_ours/top3_replace0.1_max5000_batch5",
            "device": "cuda",
            "rationalization_config": "config//top3_replace0.1_max5000_batch5.json",
            "input_num_ratio": 1.0,
            "logfolder": "logs/analogies/gpt2_xl_ours/top3_replace0.1_max5000_batch5",
            "loglevel": 20
        },
        "time_elapsed": 20.350032567977905,
        "separate_rational": [
            [
                " so",
                " turned",
                " it",
                " simplest",
                "'t",
                " end",
                " to",
                " tried"
            ],
            [
                "'t",
                " so",
                " simplest",
                " ever",
                " (",
                " out",
                " tried",
                " encountering"
            ],
            [
                " did",
                " end",
                " so",
                " when",
                " simplest",
                " vibr",
                " wasn",
                " ever"
            ],
            [
                " But",
                " it",
                " so",
                "'t",
                " up",
                " simplest",
                " it",
                " out"
            ],
            [
                " simplest",
                " wasn",
                "'t",
                " so",
                "ating",
                " vibr",
                " encountering",
                " thing"
            ]
        ]
    }
}