{
    "$schema": "../docs/rationalization.schema.json",
    "id": 24,
    "input-text": [
        "When",
        " my",
        " flight",
        " landed",
        " in",
        " Iraq",
        ",",
        " I",
        " converted",
        " my",
        " currency",
        " and",
        " slowly",
        " fell",
        " asleep",
        ".",
        " (",
        "I",
        " was",
        " behind",
        " on",
        " a",
        " couple",
        " of",
        " assignments",
        ",",
        " but",
        " I",
        " tried",
        " not",
        " to",
        " think",
        " about",
        " them",
        ").",
        " I",
        " was",
        " staying",
        " in",
        " the",
        " capital",
        ","
    ],
    "input-tokens": [
        2215,
        616,
        5474,
        11406,
        287,
        3908,
        11,
        314,
        11513,
        616,
        7395,
        290,
        6364,
        3214,
        16039,
        13,
        357,
        40,
        373,
        2157,
        319,
        257,
        3155,
        286,
        25815,
        11,
        475,
        314,
        3088,
        407,
        284,
        892,
        546,
        606,
        737,
        314,
        373,
        10589,
        287,
        262,
        3139,
        11
    ],
    "target-text": " Baghdad",
    "target-token": 19761,
    "rational-size": 5,
    "rational-positions": [
        40,
        5,
        2,
        37,
        3
    ],
    "rational-text": [
        " capital",
        " Iraq",
        " flight",
        " staying",
        " landed"
    ],
    "rational-tokens": [
        3139,
        3908,
        5474,
        10589,
        11406
    ],
    "importance-scores": [
        0.04801291227340698,
        0.0372532457113266,
        0.080111563205719,
        0.05187012255191803,
        0.022092964500188828,
        0.1169930174946785,
        0.006226635072380304,
        0.00671808747574687,
        0.024549979716539383,
        0.009014205075800419,
        0.02960161678493023,
        0.007478700019419193,
        0.0158830676227808,
        0.01135996077209711,
        0.02636834606528282,
        0.008395594544708729,
        0.012592274695634842,
        0.00621177488937974,
        0.006035177502781153,
        0.009087310172617435,
        0.004438926000148058,
        0.0038876065518707037,
        0.016958165913820267,
        0.0054826741106808186,
        0.045091692358255386,
        0.004788885358721018,
        0.009160498157143593,
        0.005930325016379356,
        0.013791028410196304,
        0.007132240571081638,
        0.005108680110424757,
        0.013392694294452667,
        0.009485268034040928,
        0.012784752994775772,
        0.034448545426130295,
        0.012284886091947556,
        0.013265200890600681,
        0.0530063770711422,
        0.0125710004940629,
        0.014547356404364109,
        0.14317789673805237,
        0.023408669978380203
    ],
    "comments": {
        "created-by": "run_analogies.py",
        "args": {
            "model": "gpt2-xl",
            "cache_dir": "./cache/",
            "tokenizer": "gpt2-xl",
            "data_dir": "data/analogies/gpt2_xl/",
            "importance_results_dir": "rationalization_results/analogies/gpt2_xl_gradient_shap",
            "device": "cuda",
            "rationalization_config": "config/eva_gradient_shap.json",
            "input_num_ratio": 1,
            "logfolder": "logs/analogies/gpt2_xl_gradient_shap",
            "loglevel": 20
        },
        "time_elapsed": 0.19620084762573242
    }
}