{
    "$schema": "../docs/rationalization.schema.json",
    "id": 54,
    "input-text": [
        "When",
        " my",
        " flight",
        " landed",
        " in",
        " Chile",
        ",",
        " I",
        " converted",
        " my",
        " currency",
        " and",
        " slowly",
        " fell",
        " asleep",
        ".",
        " (",
        "I",
        " was",
        " behind",
        " on",
        " a",
        " couple",
        " of",
        " assignments",
        ",",
        " but",
        " I",
        " tried",
        " not",
        " to",
        " think",
        " about",
        " them",
        ").",
        " I",
        " was",
        " staying",
        " in",
        " the",
        " capital",
        ","
    ],
    "input-tokens": [
        2215,
        616,
        5474,
        11406,
        287,
        17456,
        11,
        314,
        11513,
        616,
        7395,
        290,
        6364,
        3214,
        16039,
        13,
        357,
        40,
        373,
        2157,
        319,
        257,
        3155,
        286,
        25815,
        11,
        475,
        314,
        3088,
        407,
        284,
        892,
        546,
        606,
        737,
        314,
        373,
        10589,
        287,
        262,
        3139,
        11
    ],
    "target-text": " Santiago",
    "target-token": 34802,
    "rational-size": 5,
    "rational-positions": [
        40,
        5,
        3,
        37,
        2
    ],
    "rational-text": [
        " capital",
        " Chile",
        " landed",
        " staying",
        " flight"
    ],
    "rational-tokens": [
        3139,
        17456,
        11406,
        10589,
        5474
    ],
    "importance-scores": [
        0.02537328191101551,
        0.018021447584033012,
        0.03311045467853546,
        0.03684530407190323,
        0.016444800421595573,
        0.14044012129306793,
        0.009641135111451149,
        0.007852642796933651,
        0.02323201112449169,
        0.00916155707091093,
        0.020572680979967117,
        0.00815465860068798,
        0.01570410281419754,
        0.013813582248985767,
        0.021253541111946106,
        0.009451904334127903,
        0.008719916455447674,
        0.007643597200512886,
        0.00776127353310585,
        0.009672067128121853,
        0.005344175733625889,
        0.004913195967674255,
        0.016247043386101723,
        0.010162736289203167,
        0.029147490859031677,
        0.006965326145291328,
        0.009117704816162586,
        0.00724917184561491,
        0.016057221218943596,
        0.007666764315217733,
        0.005277394317090511,
        0.014570223167538643,
        0.009982596151530743,
        0.014349334873259068,
        0.02058161422610283,
        0.012050852179527283,
        0.012489700689911842,
        0.036613829433918,
        0.01050807349383831,
        0.010705727152526379,
        0.2904333174228668,
        0.0066965543664991856
    ],
    "comments": {
        "created-by": "run_analogies.py",
        "args": {
            "model": "gpt2-xl",
            "cache_dir": "./cache/",
            "tokenizer": "gpt2-xl",
            "data_dir": "data/analogies/gpt2_xl/",
            "importance_results_dir": "rationalization_results/analogies/gpt2_xl_integrated_gradients",
            "device": "cuda",
            "rationalization_config": "config/eva_integrated_gradients.json",
            "input_num_ratio": 1,
            "logfolder": "logs/analogies/gpt2_xl_integrated_gradients",
            "loglevel": 20
        },
        "time_elapsed": 0.9838216304779053
    }
}