{
    "$schema": "../docs/rationalization.schema.json",
    "id": 80,
    "input-text": [
        "I",
        " initially",
        " invited",
        " my",
        " sons",
        ",",
        " who",
        " gladly",
        " accepted",
        " my",
        " invitation",
        ".",
        " (",
        "My",
        " favorite",
        " song",
        " just",
        " came",
        " on",
        ",",
        " so",
        " I",
        " was",
        " able",
        " to",
        " relax",
        ").",
        " When",
        " I",
        " learned",
        " that",
        " women",
        " were",
        " allowed",
        ",",
        " I",
        " went",
        " ahead",
        " and",
        " also",
        " invited",
        " my"
    ],
    "input-tokens": [
        40,
        7317,
        9392,
        616,
        11989,
        11,
        508,
        35092,
        6292,
        616,
        17023,
        13,
        357,
        3666,
        4004,
        3496,
        655,
        1625,
        319,
        11,
        523,
        314,
        373,
        1498,
        284,
        8960,
        737,
        1649,
        314,
        4499,
        326,
        1466,
        547,
        3142,
        11,
        314,
        1816,
        4058,
        290,
        635,
        9392,
        616
    ],
    "target-text": " daughters",
    "target-token": 14850,
    "rational-size": 11,
    "rational-positions": [
        0,
        4,
        6,
        7,
        13,
        16,
        23,
        31,
        39,
        40,
        41
    ],
    "rational-text": [
        "I",
        " sons",
        " who",
        " gladly",
        "My",
        " just",
        " able",
        " women",
        " also",
        " invited",
        " my"
    ],
    "rational-tokens": [
        40,
        11989,
        508,
        35092,
        3666,
        655,
        1498,
        1466,
        635,
        9392,
        616
    ],
    "importance-scores": [
        0.008069973438978195,
        0.021784871816635132,
        0.0020478994119912386,
        0.005181724205613136,
        0.15526340901851654,
        0.00197143224067986,
        0.01641141250729561,
        0.045706626027822495,
        0.0014292161213234067,
        0.017981169745326042,
        0.007563511375337839,
        0.0070470585487782955,
        0.08845767378807068,
        0.006255181971937418,
        0.019710127264261246,
        0.001768631860613823,
        0.005865485407412052,
        0.0029269319493323565,
        0.0018706010887399316,
        0.007347357925027609,
        0.003566515166312456,
        0.002112173242494464,
        0.01975323259830475,
        0.001358816516585648,
        0.002465927042067051,
        0.003169124247506261,
        0.004035186022520065,
        0.005864331964403391,
        0.012011023238301277,
        0.00205812300555408,
        0.0034238812513649464,
        0.007253145333379507,
        0.0016780814621597528,
        0.08316043764352798,
        0.0152354184538126,
        0.002563648857176304,
        0.0078668761998415,
        0.0030791277531534433,
        0.0035103417467325926,
        0.002805711468681693,
        0.21077442169189453,
        0.1775941550731659
    ],
    "comments": {
        "created-by": "run_analogies.py",
        "args": {
            "model": "gpt2-medium",
            "cache_dir": "cache/",
            "tokenizer": "gpt2-medium",
            "data_dir": "data/analogies/gpt2",
            "importance_results_dir": "rationalization_results/analogies/gpt2_ours/top3_replace0.3_max3000_batch10",
            "device": "cuda",
            "rationalization_config": "config//top3_replace0.3_max3000_batch10.json",
            "input_num_ratio": 1.0,
            "logfolder": "logs/analogies/gpt2_ours/top3_replace0.3_max3000_batch10",
            "loglevel": 20
        },
        "time_elapsed": 186.00983786582947,
        "separate_rational": [
            [
                " initially",
                " favorite",
                " my",
                " sons",
                " who"
            ],
            [
                " sons",
                " When",
                " my",
                " women",
                " also"
            ],
            [
                " gladly",
                " was",
                ",",
                " sons",
                ","
            ],
            [
                " allowed",
                " I",
                " sons",
                "I",
                " invited"
            ],
            [
                " my",
                " sons",
                " invited",
                " women",
                " so"
            ],
            [
                " invited",
                " that",
                " just",
                " able",
                " sons"
            ],
            [
                " my",
                " sons",
                " song",
                " women",
                " also"
            ],
            [
                " invited",
                " able",
                "My",
                " sons",
                " came"
            ],
            [
                " (",
                " gladly",
                " women",
                " invited",
                " sons"
            ],
            [
                " who",
                " sons",
                " just",
                "My",
                "I"
            ]
        ]
    }
}