{
    "$schema": "../docs/rationalization.schema.json",
    "id": 40,
    "input-text": [
        "When",
        " my",
        " flight",
        " landed",
        " in",
        " Jamaica",
        ",",
        " I",
        " converted",
        " my",
        " currency",
        " and",
        " slowly",
        " fell",
        " asleep",
        ".",
        " (",
        "I",
        " was",
        " behind",
        " on",
        " a",
        " couple",
        " of",
        " assignments",
        ",",
        " but",
        " I",
        " tried",
        " not",
        " to",
        " think",
        " about",
        " them",
        ").",
        " I",
        " was",
        " staying",
        " in",
        " the",
        " capital",
        ","
    ],
    "input-tokens": [
        2215,
        616,
        5474,
        11406,
        287,
        31620,
        11,
        314,
        11513,
        616,
        7395,
        290,
        6364,
        3214,
        16039,
        13,
        357,
        40,
        373,
        2157,
        319,
        257,
        3155,
        286,
        25815,
        11,
        475,
        314,
        3088,
        407,
        284,
        892,
        546,
        606,
        737,
        314,
        373,
        10589,
        287,
        262,
        3139,
        11
    ],
    "target-text": " Kingston",
    "target-token": 34612,
    "rational-size": 10,
    "rational-positions": [
        3,
        4,
        5,
        34,
        35,
        36,
        37,
        38,
        39,
        40
    ],
    "rational-text": [
        " landed",
        " in",
        " Jamaica",
        ").",
        " I",
        " was",
        " staying",
        " in",
        " the",
        " capital"
    ],
    "rational-tokens": [
        11406,
        287,
        31620,
        737,
        314,
        373,
        10589,
        287,
        262,
        3139
    ],
    "importance-scores": [
        9.37985533567652e-34,
        2.4597534237262318e-21,
        1.3727954756425428e-33,
        3.1885903639672364e-11,
        0.1963234841823578,
        0.20000000298023224,
        1.0252585320739188e-32,
        8.086155259812524e-19,
        8.106645507144141e-28,
        3.161012454841407e-32,
        2.3323712665029183e-26,
        3.628648284607632e-21,
        5.290761601653084e-22,
        2.748122071746582e-26,
        6.563389588765123e-12,
        1.0836746929735004e-24,
        6.061621205775079e-37,
        8.235897808513665e-32,
        1.8945555237671527e-42,
        2.717390094226131e-21,
        1.4309170782073774e-28,
        6.63116741319617e-18,
        1.6228229863091991e-34,
        7.3697592051926645e-22,
        3.740639609150658e-32,
        1.7312863967443943e-21,
        6.803609005862669e-22,
        1.3792254247228852e-25,
        2.2257320632590104e-26,
        3.4453638986118625e-19,
        1.9230324213045041e-26,
        2.1893206332502708e-35,
        6.638971336805892e-23,
        1.5404645015341141e-24,
        0.20365948975086212,
        7.691095760264943e-08,
        1.403771292221199e-16,
        2.960721945388656e-11,
        4.08793130191043e-06,
        0.20001240074634552,
        0.20000047981739044,
        1.300247385914735e-20
    ],
    "comments": {
        "created-by": "run_analogies.py",
        "args": {
            "model": "gpt2-medium",
            "cache_dir": "cache/",
            "tokenizer": "gpt2-medium",
            "data_dir": "data/analogies/gpt2/",
            "importance_results_dir": "rationalization_results/analogies/gpt2_ours/top3_replace0.1_max3000_batch5",
            "device": "cuda",
            "rationalization_config": "config/gpt2/top3_replace0.1_max3000_batch5.json",
            "input_num_ratio": 1.0,
            "logfolder": "logs/analogies/gpt2_ours/top3_replace0.1_max3000_batch5",
            "loglevel": 20
        },
        "time_elapsed": 59.00793242454529,
        "separate_rational": [
            [
                ").",
                " I",
                " Jamaica",
                " landed",
                " the",
                " asleep",
                " capital",
                " a"
            ],
            [
                " the",
                " capital",
                " I",
                " Jamaica",
                ").",
                " I",
                " in",
                " in"
            ],
            [
                " in",
                ").",
                " the",
                " in",
                " capital",
                " staying",
                " Jamaica",
                " landed"
            ],
            [
                " capital",
                " Jamaica",
                " the",
                " was",
                " in",
                ").",
                " about",
                ","
            ],
            [
                " Jamaica",
                ").",
                " staying",
                " landed",
                " the",
                " was",
                " in",
                " capital"
            ]
        ]
    }
}