{
    "$schema": "../docs/rationalization.schema.json",
    "id": 7,
    "input-text": [
        "</s>",
        "As",
        " soon",
        " as",
        " I",
        " arrived",
        " in",
        " Iran",
        ",",
        " I",
        " checked",
        " into",
        " my",
        " hotel",
        " and",
        " took",
        " a",
        " long",
        " nap",
        ".",
        " (",
        "I",
        " had",
        " finally",
        " finished",
        " the",
        " book",
        " I",
        " was",
        " reading",
        " and",
        " it",
        " was",
        " amazing",
        ").",
        " I",
        " had",
        " to",
        " figure",
        " out",
        " the",
        " exchange",
        " rate",
        " to",
        " the",
        " local",
        " currency",
        ",",
        " which",
        " is",
        " apparently",
        " called",
        " the",
        " r"
    ],
    "input-tokens": [
        2,
        1620,
        1010,
        25,
        38,
        2035,
        11,
        1603,
        6,
        38,
        7869,
        88,
        127,
        2303,
        8,
        362,
        10,
        251,
        16159,
        4,
        36,
        100,
        56,
        1747,
        1550,
        5,
        1040,
        38,
        21,
        2600,
        8,
        24,
        21,
        2770,
        322,
        38,
        56,
        7,
        1955,
        66,
        5,
        2081,
        731,
        7,
        5,
        400,
        2593,
        6,
        61,
        16,
        4100,
        373,
        5,
        910
    ],
    "target-text": "ial",
    "target-token": 2617,
    "rational-size": 9,
    "rational-positions": [
        0,
        1,
        2,
        3,
        7,
        29,
        45,
        46,
        53
    ],
    "rational-text": [
        "</s>",
        "As",
        " soon",
        " as",
        " Iran",
        " reading",
        " local",
        " currency",
        " r"
    ],
    "rational-tokens": [
        2,
        1620,
        1010,
        25,
        1603,
        2600,
        400,
        2593,
        910
    ],
    "importance-scores": [
        0.014088108204305172,
        2.6452244838992556e-09,
        0.003929419908672571,
        9.349735612465548e-13,
        2.048704095258813e-09,
        0.0508643239736557,
        9.879678455546048e-13,
        0.34868332743644714,
        2.928800979518087e-09,
        6.9520980083837e-09,
        1.1789316886279266e-05,
        3.163966539432295e-05,
        1.4521061020289494e-09,
        2.2782304931467934e-09,
        1.1846099188389525e-12,
        9.46460113482317e-06,
        0.005051278974860907,
        1.1794605006207326e-12,
        3.0532310620751124e-12,
        1.6079242971811514e-12,
        5.384238832562005e-09,
        2.4126800817619865e-12,
        5.413442139001745e-09,
        1.653824188707631e-09,
        3.500132475520168e-12,
        1.6718995077269483e-09,
        1.3200943159777379e-12,
        2.1673416100015386e-12,
        1.5406637077219898e-09,
        0.07708416879177094,
        1.495950073149288e-06,
        1.1383028851105759e-12,
        6.612464482219638e-13,
        1.274301109077669e-09,
        3.5739085433306172e-06,
        1.0260374364370883e-12,
        1.4521123858912688e-08,
        5.169446648523035e-09,
        1.1993142834398896e-05,
        5.9498492191778496e-05,
        4.139441898587393e-06,
        2.890849145842367e-06,
        6.66954136363529e-09,
        4.821878974325955e-05,
        5.945912207039328e-09,
        8.72203020918505e-09,
        2.440576827211771e-05,
        1.110247202333603e-12,
        8.282216003863141e-05,
        6.558403451394079e-13,
        1.5093784000441701e-09,
        7.371383617282845e-06,
        9.478456908240673e-10,
        0.5
    ],
    "comments": {
        "created-by": "run_analogies.py",
        "args": {
            "model": "facebook/opt-1.3b",
            "cache_dir": "cache/",
            "tokenizer": "facebook/opt-1.3b",
            "data_dir": "data/analogies/OPT1B",
            "importance_results_dir": "rationalization_results/analogies/OPT1B_ours/top3_replace0.3_max3000_batch10",
            "device": "cuda",
            "rationalization_config": "config//top3_replace0.3_max3000_batch10.json",
            "input_num_ratio": 1.0,
            "logfolder": "logs/analogies/OPT1B_ours/top3_replace0.3_max3000_batch10",
            "loglevel": 20
        },
        "time_elapsed": 750.8062453269958,
        "separate_rational": [
            [
                " r",
                " which",
                " rate",
                " the",
                "As"
            ],
            [
                " Iran",
                " local",
                " r",
                " currency",
                " reading"
            ],
            [
                " r",
                "</s>",
                "As",
                " soon",
                " as"
            ],
            [
                " r",
                "</s>",
                "As",
                " soon",
                " as"
            ],
            [
                " Iran",
                " called",
                " currency",
                " r",
                " is"
            ],
            [
                " r",
                "</s>",
                "As",
                " soon",
                " as"
            ],
            [
                " r",
                "</s>",
                "As",
                " soon",
                " as"
            ],
            [
                " r",
                "</s>",
                "As",
                " soon",
                " as"
            ],
            [
                " reading",
                " arrived",
                " Iran",
                "</s>",
                " a"
            ],
            [
                " r",
                " into",
                " currency",
                " Iran",
                " local"
            ]
        ]
    }
}