{
    "$schema": "../docs/rationalization.schema.json",
    "id": 82,
    "input-text": [
        "I",
        " initially",
        " invited",
        " my",
        " father",
        ",",
        " who",
        " gladly",
        " accepted",
        " my",
        " invitation",
        ".",
        " (",
        "My",
        " favorite",
        " song",
        " just",
        " came",
        " on",
        ",",
        " so",
        " I",
        " was",
        " able",
        " to",
        " relax",
        ").",
        " When",
        " I",
        " learned",
        " that",
        " women",
        " were",
        " allowed",
        ",",
        " I",
        " went",
        " ahead",
        " and",
        " also",
        " invited",
        " my"
    ],
    "input-tokens": [
        40,
        7317,
        9392,
        616,
        2988,
        11,
        508,
        35092,
        6292,
        616,
        17023,
        13,
        357,
        3666,
        4004,
        3496,
        655,
        1625,
        319,
        11,
        523,
        314,
        373,
        1498,
        284,
        8960,
        737,
        1649,
        314,
        4499,
        326,
        1466,
        547,
        3142,
        11,
        314,
        1816,
        4058,
        290,
        635,
        9392,
        616
    ],
    "target-text": " mother",
    "target-token": 2802,
    "rational-size": 5,
    "rational-positions": [
        4,
        7,
        31,
        1,
        2
    ],
    "rational-text": [
        " father",
        " gladly",
        " women",
        " initially",
        " invited"
    ],
    "rational-tokens": [
        2988,
        35092,
        1466,
        7317,
        9392
    ],
    "importance-scores": [
        0.043117742985486984,
        0.06215185672044754,
        0.06036146357655525,
        0.03035087138414383,
        0.12936046719551086,
        0.007074658293277025,
        0.009689857251942158,
        0.06893184781074524,
        0.026047084480524063,
        0.01084339339286089,
        0.04301472753286362,
        0.007526481989771128,
        0.010639735497534275,
        0.011742641218006611,
        0.034725744277238846,
        0.03131844475865364,
        0.008306865580379963,
        0.008119466714560986,
        0.003855816787108779,
        0.002810360863804817,
        0.005413373466581106,
        0.004538011737167835,
        0.004375826101750135,
        0.018761582672595978,
        0.002511802362278104,
        0.039462462067604065,
        0.020639726892113686,
        0.013316269032657146,
        0.0074378978461027145,
        0.033719923347234726,
        0.007822906598448753,
        0.06400185823440552,
        0.006599596701562405,
        0.027964763343334198,
        0.005534464027732611,
        0.00991879403591156,
        0.011562522500753403,
        0.021173590794205666,
        0.004925164394080639,
        0.019001487642526627,
        0.04284331575036049,
        0.01848502643406391
    ],
    "comments": {
        "created-by": "run_analogies.py",
        "args": {
            "model": "gpt2-xl",
            "cache_dir": "./cache/",
            "tokenizer": "gpt2-xl",
            "data_dir": "data/analogies/gpt2_xl/",
            "importance_results_dir": "rationalization_results/analogies/gpt2_xl_input_x_gradient",
            "device": "cuda",
            "rationalization_config": "config/eva_input_x_gradient.json",
            "input_num_ratio": 1,
            "logfolder": "logs/analogies/gpt2_xl_input_x_gradient",
            "loglevel": 20
        },
        "time_elapsed": 0.13541698455810547
    }
}