{
    "$schema": "../docs/rationalization.schema.json",
    "id": 20,
    "input-text": [
        "</s>",
        "I",
        " had",
        " never",
        " been",
        " friends",
        " with",
        " any",
        " Chinese",
        " people",
        " before",
        ".",
        " (",
        "The",
        " funn",
        "iest",
        " thing",
        " happened",
        " to",
        " me",
        " the",
        " other",
        " day",
        ",",
        " but",
        " that",
        "'s",
        " a",
        " story",
        " for",
        " another",
        " time",
        ").",
        " In",
        " fact",
        ",",
        " I",
        " had",
        " never",
        " even",
        " been",
        " to"
    ],
    "input-tokens": [
        2,
        100,
        56,
        393,
        57,
        964,
        19,
        143,
        1111,
        82,
        137,
        4,
        36,
        133,
        29310,
        7098,
        631,
        1102,
        7,
        162,
        5,
        97,
        183,
        6,
        53,
        14,
        18,
        10,
        527,
        13,
        277,
        86,
        322,
        96,
        754,
        6,
        38,
        56,
        393,
        190,
        57,
        7
    ],
    "target-text": " China",
    "target-token": 436,
    "rational-size": 5,
    "rational-positions": [
        0,
        41,
        8,
        32,
        7
    ],
    "rational-text": [
        "</s>",
        " to",
        " Chinese",
        ").",
        " any"
    ],
    "rational-tokens": [
        2,
        7,
        1111,
        322,
        143
    ],
    "importance-scores": [
        0.05685969442129135,
        0.023067086935043335,
        0.023020397871732712,
        0.022999458014965057,
        0.0229802243411541,
        0.022981468588113785,
        0.02298431657254696,
        0.02307029813528061,
        0.023251090198755264,
        0.023005113005638123,
        0.0229951124638319,
        0.02302982285618782,
        0.0229850634932518,
        0.02305559627711773,
        0.022960897535085678,
        0.022974874824285507,
        0.02297215908765793,
        0.022981001064181328,
        0.022972971200942993,
        0.02300241030752659,
        0.022968197241425514,
        0.022967642173171043,
        0.02297491393983364,
        0.022971976548433304,
        0.022961856797337532,
        0.022956103086471558,
        0.022954972460865974,
        0.022954529151320457,
        0.022955527529120445,
        0.022954454645514488,
        0.02295507676899433,
        0.022955693304538727,
        0.023100895807147026,
        0.02301962487399578,
        0.023004528135061264,
        0.02299323119223118,
        0.022995078936219215,
        0.02296929992735386,
        0.022991839796304703,
        0.02299955114722252,
        0.022988203912973404,
        0.023257622495293617
    ],
    "comments": {
        "created-by": "run_analogies.py",
        "args": {
            "model": "KoboldAI/OPT-6.7B-Erebus",
            "cache_dir": "cache/",
            "tokenizer": "KoboldAI/OPT-6.7B-Erebus",
            "data_dir": "data/analogies/OPT6B/",
            "importance_results_dir": "rationalization_results/analogies/OPT6B_last_attention",
            "device": "cuda",
            "rationalization_config": "config/eva_last_attention.json",
            "input_num_ratio": 1,
            "logfolder": "logs/analogies/OPT6B_last_attention",
            "loglevel": 20
        },
        "time_elapsed": 0.07737278938293457
    }
}