{
    "$schema": "../docs/rationalization.schema.json",
    "id": 7,
    "input-text": [
        "When",
        " my",
        " flight",
        " landed",
        " in",
        " Cuba",
        ",",
        " I",
        " converted",
        " my",
        " currency",
        " and",
        " slowly",
        " fell",
        " asleep",
        ".",
        " (",
        "I",
        " had",
        " a",
        " terrifying",
        " dream",
        " about",
        " my",
        " grandmother",
        ",",
        " but",
        " that",
        "'s",
        " a",
        " story",
        " for",
        " another",
        " time",
        ").",
        " I",
        " was",
        " staying",
        " in",
        " the",
        " capital",
        ","
    ],
    "input-tokens": [
        2215,
        616,
        5474,
        11406,
        287,
        14159,
        11,
        314,
        11513,
        616,
        7395,
        290,
        6364,
        3214,
        16039,
        13,
        357,
        40,
        550,
        257,
        17623,
        4320,
        546,
        616,
        18410,
        11,
        475,
        326,
        338,
        257,
        1621,
        329,
        1194,
        640,
        737,
        314,
        373,
        10589,
        287,
        262,
        3139,
        11
    ],
    "target-text": " Havana",
    "target-token": 40274,
    "rational-size": 5,
    "rational-positions": [
        0,
        1,
        2,
        4,
        3
    ],
    "rational-text": [
        "When",
        " my",
        " flight",
        " in",
        " landed"
    ],
    "rational-tokens": [
        2215,
        616,
        5474,
        287,
        11406
    ],
    "importance-scores": [
        0.06217160075902939,
        0.02287413366138935,
        0.022874020040035248,
        0.02287396602332592,
        0.02287399210035801,
        0.02287391945719719,
        0.022873954847455025,
        0.02287389524281025,
        0.022873884066939354,
        0.02287386916577816,
        0.02287386730313301,
        0.022873882204294205,
        0.022873852401971817,
        0.022873852401971817,
        0.022873852401971817,
        0.022873880341649055,
        0.022873854264616966,
        0.022873839363455772,
        0.022873837500810623,
        0.022873833775520325,
        0.022873831912875175,
        0.022873828187584877,
        0.022873831912875175,
        0.022873826324939728,
        0.022873828187584877,
        0.022873831912875175,
        0.022873828187584877,
        0.022873828187584877,
        0.022873826324939728,
        0.02287382446229458,
        0.022873826324939728,
        0.022873826324939728,
        0.02287382446229458,
        0.02287382259964943,
        0.022873856127262115,
        0.022873831912875175,
        0.022873830050230026,
        0.022873828187584877,
        0.02287382259964943,
        0.02287382073700428,
        0.02287381887435913,
        0.022873815149068832
    ],
    "comments": {
        "created-by": "run_analogies.py",
        "args": {
            "model": "gpt2-medium",
            "cache_dir": "./cache/",
            "tokenizer": "gpt2-medium",
            "data_dir": "data/analogies/gpt2/",
            "importance_results_dir": "rationalization_results/analogies/gpt2_attention_rollout",
            "device": "cuda",
            "rationalization_config": "config/eva_attention_rollout.json",
            "input_num_ratio": 1,
            "logfolder": "logs/analogies/gpt2_attention_rollout",
            "loglevel": 20
        },
        "time_elapsed": 0.014159679412841797
    }
}